{
  "week": "2026-S38",
  "short": "S38",
  "range": "12 — 18 septembre 2026",
  "from": "2026-09-12",
  "to": "2026-09-18",
  "theme": "archive",
  "bodyClass": "",
  "hero_image": "https://www.panteracine.com/wp-content/uploads/2016/05/phoenix-poster.jpg",
  "hero_title": "Phoenix",
  "hero_meta": "Christian Petzold · 2014 · Allemagne",
  "schema_version": 1,
  "title": "Sélection TV — 12 — 18 septembre 2026",
  "path": "semaines/2026-S38/",
  "pages": [
    {
      "id": "couverture",
      "className": "page cover",
      "html": "<div class=\"topbar\">Sélection TV<span class=\"issue\">Semaine 38 · 12 — 18 septembre 2026</span></div><div class=\"kicker\">Sélection hebdomadaire · films & documentaires</div><div class=\"h1\">La semaine qui méritait votre attention</div><div class=\"deck\">Télévision, replay, documentaires, patrimoine et radar haute définition : une sélection éditoriale resserrée des programmes les plus intéressants de la semaine.</div><div class=\"coverhero\"><div><img src=\"https://www.panteracine.com/wp-content/uploads/2016/05/phoenix-poster.jpg\" alt=\"Affiche de Phoenix\" loading=\"lazy\"></div><div class=\"covercopy\"><div class=\"slot\">Samedi · 13:30 · Arte</div><h2>Phoenix</h2><p>2014 · Christian Petzold · Allemagne · 1 h 38</p><p>Une archive hebdomadaire pensée pour retrouver rapidement les films et documentaires qui valaient le détour.</p></div></div><div class=\"footer\"><span>Sélection TV · 12 septembre — 18 septembre 2026</span><span>1</span></div>"
    },
    {
      "id": "sommaire",
      "className": "page",
      "html": "<div class=\"topbar\">Sommaire<span class=\"issue\">Semaine 38</span></div><div class=\"kicker\">Navigation</div><div class=\"h1\">Sommaire</div><div class=\"deck\">Les rubriques sont cliquables ; les numéros restent utiles à l’impression.</div><div class=\"rule\"></div><div class=\"toc\"><div class=\"tocbox\"><h3>Le numéro</h3><a href=\"#rdv-1\">Rendez-vous de la semaine <span>p. 3–4</span></a><a href=\"#replay\">Replay & rattrapage <span>p. 5</span></a><a href=\"#plateformes\">Plateformes & compléments <span>p. 6</span></a><a href=\"#radar\">Radar 1080p <span>p. 7</span></a><a href=\"#index\">Index & méthode <span>p. 15</span></a></div><div class=\"tocbox\"><h3>Jour par jour</h3><a href=\"#jour-1\">Samedi 12 septembre<span>p. 8</span></a><a href=\"#jour-2\">Dimanche 13 septembre<span>p. 9</span></a><a href=\"#jour-3\">Lundi 14 septembre<span>p. 10</span></a><a href=\"#jour-4\">Mardi 15 septembre<span>p. 11</span></a><a href=\"#jour-5\">Mercredi 16 septembre<span>p. 12</span></a><a href=\"#jour-6\">Jeudi 17 septembre<span>p. 13</span></a><a href=\"#jour-7\">Vendredi 18 septembre<span>p. 14</span></a></div></div><div class=\"footer\"><span>Navigation interactive</span><span>2</span></div>"
    },
    {
      "id": "rdv-1",
      "className": "page",
      "html": "<div class=\"topbar\">Les rendez-vous de la semaine<span class=\"issue\">Semaine 38 · 12 — 18 septembre 2026</span></div><div class=\"kicker\">À ne pas laisser passer</div><div class=\"h1\">Dix rendez-vous de la semaine</div><div class=\"deck\">Cinq œuvres et programmes à placer en tête du radar.</div><div class=\"rule\"></div><div class=\"cards5\"><article class=\"card\" data-title=\"Phoenix\"><img src=\"https://www.panteracine.com/wp-content/uploads/2016/05/phoenix-poster.jpg\" alt=\"Affiche de Phoenix\" loading=\"lazy\"><span class=\"badge\">MAJEUR</span><h3>Phoenix</h3><div class=\"slot\">Sam. 12 · 13:30 · Arte</div><div class=\"meta\">Christian Petzold · 2014 · Allemagne · 1 h 38</div><div class=\"ratings\"><a href=\"https://www.imdb.com/title/tt2764784/\" target=\"_blank\" rel=\"noopener\">IMDb 7,3/10</a><span>relevé 24/09/2026</span></div><p>Un des grands films européens récents sur l’identité, la mémoire et le retour impossible après la guerre.</p><div class=\"actions\"><a href=\"https://www.imdb.com/title/tt2764784/\" target=\"_blank\" rel=\"noopener\">IMDb</a><button class=\"save\" type=\"button\">＋ À récupérer</button></div></article><article class=\"card\" data-title=\"Le Parrain\"><div class=\"poster-fallback\"><span>Le Parrain</span></div><span class=\"badge\">MAJEUR</span><h3>Le Parrain</h3><div class=\"slot\">Dim. 13 · 21:00 · Arte</div><div class=\"meta\">Francis Ford Coppola · 1972 · États-Unis · 2 h 55</div><p>Le grand récit familial et criminel de Coppola reste une pierre angulaire du cinéma américain.</p><div class=\"actions\"><button class=\"save\" type=\"button\">＋ À récupérer</button></div></article><article class=\"card\" data-title=\"Two Lovers\"><img src=\"https://media.senscritique.com/media/000008759825/0/two_lovers.jpg\" alt=\"Affiche de Two Lovers\" loading=\"lazy\"><span class=\"badge\">TRÈS FORT</span><h3>Two Lovers</h3><div class=\"slot\">Mer. 16 · 20:55 · Arte</div><div class=\"meta\">James Gray · 2008 · États-Unis · 1 h 50</div><div class=\"ratings\"><a href=\"https://www.imdb.com/title/tt1103275/\" target=\"_blank\" rel=\"noopener\">IMDb 7,0/10</a><span>relevé 24/09/2026</span></div><p>Gray transforme un triangle amoureux en tragédie intime, urbaine et profondément mélancolique.</p><div class=\"actions\"><a href=\"https://www.imdb.com/title/tt1103275/\" target=\"_blank\" rel=\"noopener\">IMDb</a><button class=\"save\" type=\"button\">＋ À récupérer</button></div></article><article class=\"card\" data-title=\"Julia\"><img src=\"https://i5.walmartimages.com/seo/Julia-movie-POSTER-Style-A-11-x-17-2007_7558b09f-b242-469b-b95a-a7c48d659b6d.86ac44e29636b6f162cb360309a9f9f7.jpeg\" alt=\"Affiche de Julia\" loading=\"lazy\"><span class=\"badge\">TRÈS FORT</span><h3>Julia</h3><div class=\"slot\">Lun. 14 · 20:55 · Arte</div><div class=\"meta\">Fred Zinnemann · 1977 · États-Unis · 1 h 58</div><p>Adaptation prestigieuse, politique et incarnée, dominée par Jane Fonda et Vanessa Redgrave.</p><div class=\"actions\"><button class=\"save\" type=\"button\">＋ À récupérer</button></div></article><article class=\"card\" data-title=\"La Firme\"><img src=\"https://images.bibelotandco.fr/uploads/images/affiche-cinema-la-firme-tom-cruise-gene-hackman-120-x-160-cm-255966_imgx1200_7.jpg\" alt=\"Affiche de La Firme\" loading=\"lazy\"><span class=\"badge\">À REVOIR</span><h3>La Firme</h3><div class=\"slot\">Mer. 16 · 13:35 · Arte</div><div class=\"meta\">Sydney Pollack · 1993 · États-Unis · 2 h 34</div><div class=\"ratings\"><a href=\"https://www.imdb.com/title/tt0106918/\" target=\"_blank\" rel=\"noopener\">IMDb 6,9/10</a><span>relevé 24/09/2026</span></div><p>Thriller juridique très efficace, intéressant pour le savoir-faire de Pollack et la paranoïa institutionnelle.</p><div class=\"actions\"><a href=\"https://www.imdb.com/title/tt0106918/\" target=\"_blank\" rel=\"noopener\">IMDb</a><button class=\"save\" type=\"button\">＋ À récupérer</button></div></article></div><a class=\"back\" href=\"#sommaire\">↑ Sommaire</a><div class=\"footer\"><span>Sélection TV · archives septembre 2026</span><span>3</span></div>"
    },
    {
      "id": "rdv-2",
      "className": "page",